{
  "schemaVersion": 1,
  "surface": "agy",
  "checkedAt": "2026-08-31",
  "productVersion": "1.1.22",
  "capabilities": [
    {
      "feature": "model.cli",
      "support": "supported",
      "stability": "stable",
      "source": "docs/evaluations/antigravity-contracts-2026-08-31.md",
      "checkedAt": "2026-08-31",
      "productVersion": "1.1.22",
      "value": "gemini-3.7-flash-high",
      "notes": "agy models listed the slug and a native headless invocation completed successfully on Windows agy 1.1.22."
    },
    {
      "feature": "effort.cli",
      "support": "supported",
      "stability": "stable",
      "source": "docs/evaluations/antigravity-contracts-2026-08-31.md",
      "checkedAt": "2026-08-31",
      "productVersion": "1.1.22",
      "value": "high",
      "notes": "agy --help documented high and the native headless invocation accepted it; max is not documented."
    },
    {
      "feature": "agents.discovery",
      "support": "supported",
      "stability": "stable",
      "source": "docs/evaluations/antigravity-contracts-2026-08-31.md",
      "checkedAt": "2026-08-31",
      "productVersion": "1.1.22",
      "value": {
        "global": "~/.gemini/config/agents/",
        "workspace": ".agents/agents/",
        "format": "Markdown YAML frontmatter",
        "invocation": "invoke_subagent"
      },
      "notes": "agy accepted --agent architect in the disposable workspace, but agy agents printed no rows; discovery remains partially observed."
    },
    {
      "feature": "hooks.lifecycle",
      "support": "supported",
      "stability": "stable",
      "source": "docs/evaluations/antigravity-contracts-2026-08-31.md",
      "checkedAt": "2026-08-31",
      "productVersion": "1.1.22",
      "value": {
        "events": [
          "PreToolUse",
          "PostToolUse",
          "PreInvocation",
          "PostInvocation",
          "Stop"
        ],
        "handler": "command"
      },
      "notes": "Events and JSON input/output are documented for CLI and Desktop. Process failure behavior and portable command-root resolution are not documented, so generated hooks stay disabled."
    },
    {
      "feature": "rules.instructions",
      "support": "supported",
      "stability": "stable",
      "source": "docs/evaluations/antigravity-contracts-2026-08-31.md",
      "checkedAt": "2026-08-31",
      "productVersion": "1.1.22",
      "value": {
        "global": "~/.gemini/GEMINI.md",
        "workspace": ".agents/rules/",
        "settings": "~/.gemini/antigravity-cli/settings.json"
      },
      "notes": "Documented CLI global/context and settings surfaces."
    },
    {
      "feature": "skills.discovery",
      "support": "supported",
      "stability": "stable",
      "source": "docs/evaluations/antigravity-contracts-2026-08-31.md",
      "checkedAt": "2026-08-31",
      "productVersion": "1.1.22",
      "value": {
        "plugin": "skills/<skill>/SKILL.md",
        "workspace": ".agents/skills/<skill>.md",
        "global": "~/.gemini/antigravity-cli/skills/<skill>.md"
      },
      "notes": "agy plugin validate accepted the folder-SKILL.md package and enumerated 28 skills, but a runtime skill invocation was not performed."
    },
    {
      "feature": "commands.plugin",
      "support": "supported",
      "stability": "stable",
      "source": "docs/evaluations/antigravity-contracts-2026-08-31.md",
      "checkedAt": "2026-08-31",
      "productVersion": "1.1.22",
      "value": {
        "commands": [
          "agy plugin list",
          "agy plugin install <path>",
          "agy plugin enable <name>",
          "agy plugin disable <name>",
          "agy plugin uninstall <name>"
        ]
      },
      "notes": "agy 1.1.22 help exposed plugin validation and management commands; validation passed, while install was not run."
    },
    {
      "feature": "statusline.native",
      "support": "supported",
      "stability": "stable",
      "source": "docs/evaluations/antigravity-contracts-2026-08-31.md",
      "checkedAt": "2026-08-31",
      "productVersion": "1.1.22",
      "value": {
        "settingsPath": "~/.gemini/antigravity-cli/settings.json",
        "type": "command",
        "input": "JSON via stdin",
        "output": "one statusline text result via stdout"
      },
      "notes": "The official CLI statusline contract is documented; repository runtime rendering remains separately unconfirmed."
    },
    {
      "feature": "install.plugin",
      "support": "supported",
      "stability": "stable",
      "source": "docs/evaluations/antigravity-contracts-2026-08-31.md",
      "checkedAt": "2026-08-31",
      "productVersion": "1.1.22",
      "value": {
        "command": "agy plugin install <local-or-remote-path>",
        "path": "~/.gemini/antigravity-cli/plugins/<name>/"
      },
      "notes": "Documented CLI staging and installation command."
    },
    {
      "feature": "model.persistence-json",
      "support": "unknown",
      "stability": "unknown",
      "source": "docs/evaluations/antigravity-contracts-2026-08-31.md",
      "checkedAt": "2026-08-31",
      "productVersion": "1.1.22",
      "value": {
        "nativeConfigKey": null,
        "persistenceVia": "/model command"
      },
      "notes": "Persistence through /model is documented, but its on-disk JSON key is not."
    }
  ]
}
