{
  "schemaVersion": 1,
  "surface": "codex",
  "checkedAt": "2026-08-31",
  "productVersion": "0.151.0-alpha.7.2",
  "capabilities": [
    {
      "feature": "instructions.global",
      "support": "supported",
      "stability": "stable",
      "source": "docs/evaluations/research-codex.md",
      "checkedAt": "2026-08-31",
      "productVersion": "0.151.0-alpha.7.2",
      "value": {
        "package": "AGENTS.md",
        "destination": "$CODEX_HOME/AGENTS.md",
        "consumers": [
          "codex-cli",
          "codex-desktop"
        ]
      },
      "notes": "The canonical global body is rendered once at the start of AGENTS.md, followed by the canonical rules; project AGENTS.override.md or AGENTS.md is the more specific second layer."
    },
    {
      "feature": "presentation.invocation",
      "support": "supported",
      "stability": "stable",
      "source": "docs/maintenance/cross-tool-quality.md",
      "checkedAt": "2026-08-31",
      "productVersion": "0.151.0-alpha.7.2",
      "value": {
        "registry": "core/presentation/emoji-registry.json",
        "checklists": "core/presentation/progress-contract.json"
      },
      "notes": "Rendered labels are display text only. Native IDs, TOML keys, and file paths remain unchanged."
    },
    {
      "feature": "model.primary",
      "support": "supported",
      "stability": "stable",
      "source": "docs/evaluations/research-model-policy-codex.md",
      "checkedAt": "2026-10-09",
      "productVersion": "0.162.0",
      "value": {
        "model": "gpt-6.1-sol",
        "reasoning": "xhigh"
      },
      "notes": "Shared CLI/Desktop primary policy. On 2026-10-09 the Codex 0.162.0 model catalog listed gpt-6.1-sol with low, medium, high, xhigh, max, and ultra reasoning, and the ChatGPT desktop app wrote gpt-6.1-sol with xhigh into config.toml on launch."
    },
    {
      "feature": "model.alternate",
      "support": "supported",
      "stability": "stable",
      "source": "docs/evaluations/research-model-policy-codex.md",
      "checkedAt": "2026-08-31",
      "productVersion": "0.151.0-alpha.7.2",
      "value": {
        "model": "gpt-5.6-terra",
        "reasoning": "max",
        "selection": "CLI profile terra-max; Desktop manual picker"
      },
      "notes": "Explicit operator-selected alternate; not automatic failover."
    },
    {
      "feature": "model.automatic-fallback",
      "support": "unsupported",
      "stability": "unsupported",
      "source": "docs/evaluations/research-model-policy-codex.md",
      "checkedAt": "2026-08-31",
      "productVersion": "0.151.0-alpha.7.2",
      "value": null,
      "notes": "No documented automatic fallback-model configuration or behavior."
    },
    {
      "feature": "effort.max",
      "support": "supported",
      "stability": "stable",
      "source": "docs/evaluations/research-model-policy-codex.md",
      "checkedAt": "2026-08-31",
      "productVersion": "0.151.0-alpha.7.2",
      "value": "max",
      "notes": "Current catalog and model guide advertise max for the selected models."
    },
    {
      "feature": "agents.discovery",
      "support": "supported",
      "stability": "stable",
      "source": "docs/evaluations/research-codex.md",
      "checkedAt": "2026-10-19",
      "productVersion": "0.151.0-alpha.7.2",
      "value": {
        "global": "~/.codex/agents/",
        "project": ".codex/agents/",
        "format": "standalone TOML",
        "builtIn": [
          "default",
          "worker",
          "explorer"
        ]
      },
      "notes": "Documented native discovery and config_file registrations. Template roles inherit parent permissions without sandbox overrides. Portable declarations are retained but native per-role enforcement must be checked against the installed client; assignment text is not a sandbox."
    },
    {
      "feature": "hooks.lifecycle",
      "support": "supported",
      "stability": "stable",
      "source": "docs/evaluations/research-codex.md",
      "checkedAt": "2026-08-31",
      "productVersion": "0.151.0-alpha.7.2",
      "value": {
        "events": [
          "SessionStart",
          "SessionEnd",
          "SubagentStart",
          "PreToolUse",
          "PermissionRequest",
          "PostToolUse",
          "PreCompact",
          "PostCompact",
          "UserPromptSubmit",
          "SubagentStop",
          "Stop"
        ],
        "handlers": [
          "command",
          "mcp_tool"
        ]
      },
      "notes": "Hook events and handlers are documented stable. Plugin hooks are not automatic before the explicit native trust step."
    },
    {
      "feature": "rules.instructions",
      "support": "supported",
      "stability": "stable",
      "source": "docs/evaluations/research-codex.md",
      "checkedAt": "2026-08-31",
      "productVersion": "0.151.0-alpha.7.2",
      "value": {
        "global": "$CODEX_HOME/AGENTS.md",
        "project": "AGENTS.md or AGENTS.override.md"
      },
      "notes": "Layered AGENTS.md discovery is documented."
    },
    {
      "feature": "skills.discovery",
      "support": "supported",
      "stability": "stable",
      "source": "docs/evaluations/research-codex.md",
      "checkedAt": "2026-08-31",
      "productVersion": "0.151.0-alpha.7.2",
      "value": ".agents/skills/<skill>/SKILL.md",
      "notes": "Repository skill discovery is documented under .agents/skills."
    },
    {
      "feature": "commands.plugin",
      "support": "unsupported",
      "stability": "unsupported",
      "source": "docs/evaluations/research-codex.md",
      "checkedAt": "2026-08-31",
      "productVersion": "0.151.0-alpha.7.2",
      "value": null,
      "notes": "Claude-style commands are not portable Codex plugin components; convert reusable behavior to skills."
    },
    {
      "feature": "statusline.native",
      "support": "supported",
      "stability": "stable",
      "source": "docs/evaluations/research-codex.md",
      "checkedAt": "2026-10-19",
      "productVersion": "0.151.0-alpha.7.2",
      "value": {
        "settingsKey": "tui.status_line",
        "surface": "CLI TUI"
      },
      "notes": "Current config reference documents tui.status_line. This package does not configure a custom Codex statusline or claim Desktop UI equivalence; --statusline-name remains Claude-only."
    },
    {
      "feature": "install.plugin",
      "support": "supported",
      "stability": "stable",
      "source": "docs/evaluations/research-codex.md",
      "checkedAt": "2026-08-31",
      "productVersion": "0.151.0-alpha.7.2",
      "value": {
        "manifest": ".codex-plugin/plugin.json",
        "paths": "plugin-root-relative"
      },
      "notes": "Direct Codex plugin packaging is documented."
    }
  ]
}
