{
  "schemaVersion": 1,
  "surface": "claude",
  "checkedAt": "2026-08-31",
  "productVersion": "2.1.251",
  "capabilities": [
    {
      "feature": "instructions.global",
      "support": "supported",
      "stability": "stable",
      "source": "docs/evaluations/research-claude-code.md",
      "checkedAt": "2026-10-09",
      "productVersion": "2.1.295",
      "value": {
        "package": "config/CLAUDE.md",
        "destination": "<CLAUDE_CONFIG_DIR>/CLAUDE.md"
      },
      "notes": "The shared global instruction body is deployed separately from the rule files under <CLAUDE_CONFIG_DIR>/rules/all-about-agents/ and from project instructions. The package file sits under config/ because Claude Code 2.1.295 reports a plugin-root CLAUDE.md as never loaded, which fails `claude plugin validate --strict`; observed on macOS on 2026-10-09, where the config/ layout passed."
    },
    {
      "feature": "model.primary",
      "support": "supported",
      "stability": "stable",
      "source": "docs/evaluations/research-model-policy-claude.md",
      "checkedAt": "2026-09-28",
      "productVersion": "2.1.283",
      "value": "opus[1m]",
      "notes": "Documented alias for the latest Opus model with a 1M-token context window; an alias does not go stale when a new Opus ships."
    },
    {
      "feature": "model.fallback",
      "support": "supported",
      "stability": "stable",
      "source": "docs/evaluations/research-model-policy-claude.md",
      "checkedAt": "2026-08-31",
      "productVersion": "2.1.251",
      "value": [
        "claude-sonnet-5"
      ],
      "notes": "Documented fallback chain for qualifying server failures; provider and access limits still apply."
    },
    {
      "feature": "model.advisor",
      "support": "supported",
      "stability": "stable",
      "source": "docs/evaluations/research-model-policy-claude.md",
      "checkedAt": "2026-09-02",
      "productVersion": "2.1.258",
      "value": "claude-fable-5-1",
      "notes": "Documented Fable 5.1 advisor; it requires Claude Code v2.1.255 or later, and account, organization, plan, provider, consent, and product-version access limits may apply."
    },
    {
      "feature": "effort.xhigh",
      "support": "supported",
      "stability": "stable",
      "source": "docs/evaluations/research-model-policy-claude.md",
      "checkedAt": "2026-09-02",
      "productVersion": "2.1.258",
      "value": {
        "environment": "CLAUDE_CODE_EFFORT_LEVEL",
        "value": "xhigh"
      },
      "notes": "Persistent xhigh effort is documented through the environment setting, not effortLevel. xhigh is the deepest adaptive-reasoning level, and Opus 5 always uses adaptive reasoning."
    },
    {
      "feature": "agents.discovery",
      "support": "supported",
      "stability": "stable",
      "source": "docs/evaluations/research-claude-code.md",
      "checkedAt": "2026-08-31",
      "productVersion": "2.1.251",
      "value": {
        "global": "~/.claude/agents/",
        "project": ".claude/agents/",
        "plugin": "agents/",
        "format": "Markdown YAML frontmatter"
      },
      "notes": "Documented user, project, and plugin custom-agent discovery."
    },
    {
      "feature": "hooks.lifecycle",
      "support": "supported",
      "stability": "stable",
      "source": "docs/evaluations/research-claude-code.md",
      "checkedAt": "2026-08-31",
      "productVersion": "2.1.251",
      "value": {
        "events": [
          "SessionStart",
          "SessionEnd",
          "SubagentStart",
          "PreToolUse",
          "PermissionRequest",
          "PostToolUse",
          "PreCompact",
          "PostCompact",
          "UserPromptSubmit",
          "SubagentStop",
          "Stop"
        ],
        "handlers": [
          "command",
          "mcp_tool"
        ]
      },
      "notes": "Documented lifecycle events and handler types."
    },
    {
      "feature": "rules.instructions",
      "support": "supported",
      "stability": "stable",
      "source": "https://code.claude.com/docs/en/memory.md",
      "checkedAt": "2026-09-27",
      "productVersion": "2.1.251",
      "value": {
        "global": "~/.claude/CLAUDE.md",
        "rules": "~/.claude/rules/**/*.md",
        "project": "CLAUDE.md or .claude/CLAUDE.md"
      },
      "notes": "CLAUDE.md and rules are documented instruction surfaces. The memory documentation checked on 2026-09-27 says every .md file below rules/ is discovered recursively, so the package rules load from rules/all-about-agents/; the product version was not observed again for this check."
    },
    {
      "feature": "skills.discovery",
      "support": "supported",
      "stability": "stable",
      "source": "docs/evaluations/research-claude-code.md",
      "checkedAt": "2026-08-31",
      "productVersion": "2.1.251",
      "value": {
        "global": "~/.claude/skills/<skill-name>/SKILL.md",
        "plugin": "skills/<skill-name>/SKILL.md"
      },
      "notes": "Folder-based SKILL.md discovery is documented."
    },
    {
      "feature": "commands.legacy",
      "support": "supported",
      "stability": "manual",
      "source": "docs/evaluations/research-claude-code.md",
      "checkedAt": "2026-08-31",
      "productVersion": "2.1.251",
      "value": ".claude/commands/*.md",
      "notes": "Legacy commands still work; new reusable behavior should use skills."
    },
    {
      "feature": "statusline.native",
      "support": "supported",
      "stability": "stable",
      "source": "docs/evaluations/research-claude-code.md",
      "checkedAt": "2026-08-31",
      "productVersion": "2.1.251",
      "value": {
        "settingsPath": "~/.claude/settings.json",
        "type": "command",
        "input": "JSON via stdin",
        "output": "statusline text via stdout"
      },
      "notes": "Claude Code documents the native statusLine command contract; repository runtime rendering remains separately unconfirmed."
    },
    {
      "feature": "install.user-plugin",
      "support": "supported",
      "stability": "stable",
      "source": "docs/evaluations/research-claude-code.md",
      "checkedAt": "2026-08-31",
      "productVersion": "2.1.251",
      "value": {
        "scope": "user",
        "command": "claude plugin install <plugin>@<marketplace>"
      },
      "notes": "User-scoped plugin installation is documented."
    }
  ]
}
